{
    "Tabs": [
                {
                    "Id":  "BeaverTab",
                    "Label":  "Beaver",
                    "Keytip":  "B"
                },
                {
                    "Id":  "OfficeToolsTab",
                    "Label":  "Office Tools",
                    "Keytip":  "O"
                }
            ],
    "Groups":  [
                   {
                       "Id":  "GrpFormatting",
                       "Label":  "Formatting",
                       "Features":  [
                                        "BtnWrap",
                                        "BtnStaticSheetWorkbook"
                                    ]
                   },
                   {
                       "Id":  "GrpCleanup",
                       "Label":  "Data Tools",
                       "Features":  [
                                        "BtnCleanData",
                                        "BtnModifyData",
                                        "BtnHighlightData",
                                        "BtnBreakLinks"
                                    ]
                   },
                   {
                       "Id":  "GrpExport",
                       "Label":  "File Actions",
                       "Features":  [
                                        "BtnDuplicate",
                                        "BtnExport"
                                    ]
                   },
                   {
                       "Id":  "GrpReports",
                       "Label":  "Reports",
                       "Features":  [
                                        "BtnReportGenerator"
                                    ]
                   },
                   {
                       "Id":  "BeaverHelpGroup",
                       "Label":  "Support",
                       "Features":  [
                                        "BtnHelpCenter"
                                    ]
                   },
                   {
                       "Id":  "GrpHelloWorld",
                       "Label":  "Hello World Group",
                       "TabId":  "OfficeToolsTab",
                       "Features":  [
                                        "BtnHelloWorld"
                                    ]
                   }
               ],
    "Features":  [
                     {
                         "ControlId":  "BtnWrap",
                         "Label":  "Wrap",
                         "OnAction":  "Ribbon_OnWrap",
                         "Macro":  "UI_Ribbon.Ribbon_OnWrap",
                         "CommandName":  "Wrap",
                         "Icon":  "FunctionWizard",
                         "Keytip":  "W",
                         "Screentip":  "Wrap Selection",
                         "Supertip":  "Choose whether to wrap the selection by reusing a wrapper formula from another cell or by typing a formula pattern with [value].",
                         "RuntimeTestMode":  "interactive"
                     },
                     {
                         "ControlId":  "BtnStaticSheetWorkbook",
                         "Label":  "Static Sheet/WB",
                         "OnAction":  "Ribbon_OnStaticSheetWorkbook",
                         "Macro":  "UI_Ribbon.Ribbon_OnStaticSheetWorkbook",
                         "CommandName":  "StaticSheetWorkbook",
                         "Icon":  "CalculateNow",
                         "Keytip":  "SW",
                         "Screentip":  "Convert Formulas to Static Values",
                         "Supertip":  "Permanently replaces all formulas with their current values across the active sheet or the entire workbook. Handles spill ranges correctly.",
                         "RuntimeTestMode":  "interactive"
                     },
                     {
                         "ControlId":  "BtnCleanData",
                         "Label":  "Clean Data",
                         "OnAction":  "Ribbon_OnCleanData",
                         "Macro":  "UI_Ribbon.Ribbon_OnCleanData",
                         "CommandName":  "CleanData",
                         "Icon":  "Clear",
                         "Keytip":  "CD",
                         "Screentip":  "Clean Data",
                         "Supertip":  "Trims spaces and removes non-printable characters for the selected scope (Range, Sheet, or Workbook).",
                         "RuntimeTestMode":  "interactive"
                     },
                     {
                         "ControlId":  "BtnModifyData",
                         "Label":  "Modify Data",
                         "Type":  "Menu",
                         "CommandName":  "ModifyData",
                         "Icon":  "ChangeCase",
                         "Keytip":  "MD",
                         "Screentip":  "Modify Data",
                         "Supertip":  "Modifies text and dates in the selection (casing or date standardization).",
                         "MenuItems":  [
                                           "BtnDateFixer",
                                           "BtnCaseFixer",
                                           "BtnUnmergeFill",
                                           "BtnForceNumber"
                                       ]
                     },
                     {
                         "ControlId":  "BtnDateFixer",
                         "Label":  "Date Fixer",
                         "OnAction":  "Ribbon_OnDateFixer",
                         "Macro":  "UI_Ribbon.Ribbon_OnDateFixer",
                         "CommandName":  "DateFixer",
                         "CommandClass":  "FeatCmd_ModifyData",
                         "Icon":  "CalculateNow",
                         "Keytip":  "DF",
                         "Screentip":  "Date Fixer",
                         "Supertip":  "Standardizes dates in the selection.",
                         "RuntimeTestMode":  "interactive"
                     },
                     {
                         "ControlId":  "BtnCaseFixer",
                         "Label":  "Case Fixer",
                         "OnAction":  "Ribbon_OnCaseFixer",
                         "Macro":  "UI_Ribbon.Ribbon_OnCaseFixer",
                         "CommandName":  "CaseFixer",
                         "CommandClass":  "FeatCmd_ModifyData",
                         "Icon":  "ChangeCase",
                         "Keytip":  "CF",
                         "Screentip":  "Case Fixer",
                         "Supertip":  "Standardizes casing of text in the selection.",
                         "RuntimeTestMode":  "interactive"
                     },
                     {
                         "ControlId":  "BtnHighlightData",
                         "Label":  "Highlight Data",
                         "Type":  "Menu",
                         "CommandName":  "HighlightData",
                         "Icon":  "ConditionalFormattingMenu",
                         "Keytip":  "HD",
                         "Screentip":  "Highlight Data",
                         "Supertip":  "Highlights key data patterns and duplicates.",
                         "MenuItems":  [
                                           "BtnHighlightInconsistentFormulas",
                                           "BtnHighlightDuplicates",
                                           "BtnHighlightErrors",
                                           "BtnHighlightHardcodedValues",
                                           "BtnHighlightDataValidations",
                                           "BtnHighlightConditionalFormatting",
                                           "BtnHighlightFinancialModelling",
                                           "BtnClearHighlights"
                                       ]
                     },
                     {
                         "ControlId":  "BtnHighlightInconsistentFormulas",
                         "Label":  "Inconsistent Formulas",
                         "OnAction":  "Ribbon_OnHighlightInconsistentFormulas",
                         "Macro":  "UI_Ribbon.Ribbon_OnHighlightInconsistentFormulas",
                         "CommandName":  "HighlightInconsistentFormulas",
                         "CommandClass":  "FeatCmd_HighlightData",
                         "Icon":  "CalculateNow",
                         "Keytip":  "HI",
                         "Screentip":  "Inconsistent Formulas",
                         "Supertip":  "Highlights inconsistent formulas in yellow.",
                         "RuntimeTestMode":  "interactive"
                     },
                     {
                         "ControlId":  "BtnHighlightDuplicates",
                         "Label":  "Duplicates",
                         "OnAction":  "Ribbon_OnHighlightDuplicates",
                         "Macro":  "UI_Ribbon.Ribbon_OnHighlightDuplicates",
                         "CommandName":  "HighlightDuplicates",
                         "CommandClass":  "FeatCmd_HighlightData",
                         "Icon":  "ConditionalFormattingMenu",
                         "Keytip":  "HD",
                         "Screentip":  "Duplicates",
                         "Supertip":  "Highlights duplicate values in soft red.",
                         "RuntimeTestMode":  "interactive"
                     },
                     {
                         "ControlId":  "BtnHighlightErrors",
                         "Label":  "Errors",
                         "OnAction":  "Ribbon_OnHighlightErrors",
                         "Macro":  "UI_Ribbon.Ribbon_OnHighlightErrors",
                         "CommandName":  "HighlightErrors",
                         "CommandClass":  "FeatCmd_HighlightData",
                         "Icon":  "ErrorChecking",
                         "Keytip":  "HE",
                         "Screentip":  "Errors",